{
  "user_id": "7af1e20f-071b-45f5-8669-4145eaa50e9b",
  "cv_id": "2b803bc5-d675-4141-abab-719098cad7e0",
  "extracted_raw": {
    "full_name": "Guergous Mohamed",
    "email": "Mohmedguergous6@gmail.com",
    "phone": "0636257871",
    "location": "Dour iouliouil azrar Taroudant",
    "links": [],
    "skills": [
      "Word",
      "Excel",
      "Powerpoint"
    ],
    "education": [
      {
        "institution": "Faculté de science juridique Agadir",
        "degree": "Filière Droit arabe",
        "start_date": "2022",
        "end_date": null
      },
      {
        "institution": "Faculté de lettres et science humanes d’Agadir",
        "degree": "Licence d’histoire et civilisation",
        "start_date": "2014",
        "end_date": null
      },
      {
        "institution": "Lycée Ohud Temsia",
        "degree": "Baccalauréat en sciences humaines",
        "start_date": "2016",
        "end_date": null
      }
    ],
    "experience": [
      {
        "company": "Les Eaux Minérales d’Oulmès S.A",
        "role": "Merchandiser et Animateur des ventes",
        "start_date": "2025",
        "end_date": null,
        "summary": "- Mise en place et animation des ventes sur les points de distribution\n- Optimisation de la visibilité des produits en rayon\n- Remplacement du merchandiser principal sur la zone attribuée"
      },
      {
        "company": "Délègue des affaire islamique",
        "role": "Encadrement programme d’alphabétisation",
        "start_date": "2019",
        "end_date": "2022",
        "summary": "Formation d’éducation au centra académie ait Melloul"
      }
    ]
  },
  "extracted_data": {
    "full_name": "Guergous Mohamed",
    "email": "Mohmedguergous6@gmail.com",
    "phone": "0636257871",
    "location": "Dour iouliouil azrar Taroudant",
    "skills": [
      "Word",
      "Excel",
      "Powerpoint"
    ],
    "education": [
      {
        "institution": "Faculté de science juridique Agadir",
        "degree": "Filière Droit arabe",
        "start_date": "2022",
        "end_date": null
      },
      {
        "institution": "Faculté de lettres et science humanes d’Agadir",
        "degree": "Licence d’histoire et civilisation",
        "start_date": "2014",
        "end_date": null
      },
      {
        "institution": "Lycée Ohud Temsia",
        "degree": "Baccalauréat en sciences humaines",
        "start_date": "2016",
        "end_date": null
      }
    ],
    "experience": [
      {
        "company": "Les Eaux Minérales d’Oulmès S.A",
        "role": "Merchandiser et Animateur des ventes",
        "start_date": "2025",
        "end_date": null,
        "summary": "- Mise en place et animation des ventes sur les points de distribution\n- Optimisation de la visibilité des produits en rayon\n- Remplacement du merchandiser principal sur la zone attribuée"
      },
      {
        "company": "Délègue des affaire islamique",
        "role": "Encadrement programme d’alphabétisation",
        "start_date": "2019",
        "end_date": "2022",
        "summary": "Formation d’éducation au centra académie ait Melloul"
      }
    ]
  },
  "text_extracted": "Guergous Mohamed \n\nMohmedguergous6@gmail.com \n\n0636257871 \n\nDour iouliouil azrar Taroudant \n\nPermis de conduire : B \n\nETUDE ET FORMATIONS \n\n2022- \n\nEtudiant a la faculté de science juridique Agadir Filière Droit arabe \n\nAgadir, Maroc \n\n2017 – \n\nAgadir, Maroc \n\n2016– \n\nAgadir, Maroc \n\n2014 – \n\nAgadir, Maroc \n\nEtudes universitaires : obtention la licence d’histoire et civilisation a faculté de \nlettres et science humanes d’Agadir \n\nEtudes universitaires : Diplôme d’Etudes Universitaires générales \n\nEtudes secondaires obtention de baccalauréat en sciences humaines a lycée \nOhud Temsia \n\nEXPERIENCES PROFESSIONNELLES \n\n2025 \n\nAgadir, Maroc \n\n2019-2022 \n\nAgadir, Maroc \n\n2017 -2018 \n\nAgadir, Maroc \n\nMerchandiser et Animateur des ventes \n ste : Les Eaux Minérales d’Oulmès S.A \n - Mise en place et animation des ventes sur les points de distribution\n - Optimisation de la visibilité des produits en rayon\n - Remplacement du merchandiser principal sur la zone attribuée\n\nEncadrement programme d’alphabétisation chez délègue des affaire islamique \n\nformation d’éducation au centra académie ait Melloul \n\nCOMPETANCE TECHNIQUE \n\nBUREAUTIQUE : \n\nWord, Excel, Powerpoint \n\nDIVERS \n\nCentres d’intérêts \n\n-\n-\n- \n\nSports : Football, Natation.\nLa lecture La musique \n La musique \n\nLangues \n\n- Arabe et berbère : Maternelle\n- Français : Moyen\n- Anglais : Moyen",
  "thumbnail_url": "https://rwgurwnglnxihjswjute.storage.supabase.co/storage/v1/s3/cv2interviewBucket/7af1e20f-071b-45f5-8669-4145eaa50e9b/2b803bc5-d675-4141-abab-719098cad7e0/thumb.jpg?AWSAccessKeyId=55690d7de5c182a3461137ba9b0c00eb&Signature=46OGtBkSby83sjSS5v3SVfsg3wQ%3D&Expires=1761746517"
}
